{
  "name": "claude-skills",
  "description": "20-category solo-SaaS-founder platform — autonomous engineering OS, 18+ agents, 117 doctrine rules, 20+ slash commands, production forge script, LLM eval harness, MCP registry, DO agent scaffolding, RAG pipeline, multi-tenant subdomain provisioning, full-document processing (DOCX/XLSX/PDF/PPTX), and 32 AI-tool platform variants. One-line prompts to deployed Cloudflare Workers products.",
  "version": "7.2.1",
  "author": {
    "name": "Brian Zalewski",
    "url": "https://megabyte.space"
  },
  "homepage": "https://claude.megabyte.space",
  "repository": "https://github.com/heymegabyte/claude-skills",
  "license": "Rutgers",
  "keywords": [
    "autonomous",
    "product-building",
    "cloudflare-workers",
    "angular",
    "hono",
    "saas",
    "deployment",
    "design-system",
    "seo",
    "testing",
    "ai-native",
    "agents",
    "subagents",
    "orchestration"
  ],
  "skills": [
    "01-operating-system",
    "02-goal-and-brief",
    "03-planning-and-research",
    "04-preference-and-memory",
    "05-architecture-and-stack",
    "06-build-and-slice-loop",
    "07-quality-and-verification",
    "08-deploy-and-runtime-verification",
    "09-brand-and-content-system",
    "10-experience-and-design-system",
    "11-motion-and-interaction-system",
    "12-media-orchestration",
    "13-observability-and-growth",
    "14-independent-idea-engine",
    "15-site-generation",
    "16-cinematic-website-prime-directive",
    "18-document-processing",
    "19-mcp-authoring",
    "20-superpowers",
    "21-app-foundation",
    "22-visual-experience",
    "23-content-seo",
    "24-functional",
    "25-quality-performance",
    "26-platform-delivery",
    "27-trust-compliance"
  ],
  "outputStyles": ["output-styles/emdash-concise.md"],
  "monitors": "monitors/monitors.json",
  "agents": [
    "agents/accessibility-auditor.md",
    "agents/architect.md",
    "agents/changelog-generator.md",
    "agents/code-simplifier.md",
    "agents/completeness-checker.md",
    "agents/computer-use-operator.md",
    "agents/content-writer.md",
    "agents/cost-estimator.md",
    "agents/dependency-auditor.md",
    "agents/deploy-verifier.md",
    "agents/incident-responder.md",
    "agents/meta-orchestrator.md",
    "agents/migration-agent.md",
    "agents/performance-profiler.md",
    "agents/security-reviewer.md",
    "agents/seo-auditor.md",
    "agents/test-writer.md",
    "agents/visual-qa.md"
  ]
}
